{"schema_version":1,"command":"status","options":{"fetch":false,"worktrees":true},"root":"/ws","note":null,"repos":[{"name":".","path":"/ws","kind":"root","state":"ok","branch":"main","detached":false,"head":"aaaaaaaaaaaaaaaaaaaaaaaaaaaaaaaaaaaaaaaa","upstream":"origin/main","upstream_gone":false,"ahead":0,"behind":0,"changes":{"staged":0,"unstaged":0,"untracked":0,"conflicts":0},"operation":null,"stash":0,"branches":{"local":1,"base":"origin/main","integrated":0,"not_integrated":0},"worktrees":{"linked":0,"dirty":0,"locked":0,"prunable":0,"list":[],"missing":0},"gitlink":null,"fetch_error":null,"attention":false,"error":null,"reasons":[]},{"name":"busy","path":"/ws/busy","kind":"submodule","state":"ok","branch":"feat","detached":false,"head":"aaaaaaaaaaaaaaaaaaaaaaaaaaaaaaaaaaaaaaaa","upstream":"origin/main","upstream_gone":false,"ahead":2,"behind":1,"changes":{"staged":1,"unstaged":2,"untracked":3,"conflicts":1},"operation":"rebase","stash":2,"branches":{"local":4,"base":"origin/main","integrated":1,"not_integrated":2},"worktrees":{"linked":2,"dirty":1,"locked":1,"prunable":0,"list":[{"path":"/wt/one","branch":"one","detached":false,"dirty":true,"locked":null,"prunable":false,"missing":false},{"path":"/wt/two","branch":null,"detached":true,"dirty":false,"locked":"usb","prunable":false,"missing":true}],"missing":1},"gitlink":{"recorded":"aaaaaaaaaaaaaaaaaaaaaaaaaaaaaaaaaaaaaaaa","checked_out":"bbbbbbbbbbbbbbbbbbbbbbbbbbbbbbbbbbbbbbbb","state":"drift","relation":"ahead"},"fetch_error":null,"attention":true,"error":null,"reasons":["operation","conflicts","staged","unstaged","untracked","behind","diverged"]},{"name":"pinned","path":"/ws/pinned","kind":"submodule","state":"ok","branch":null,"detached":true,"head":"aaaaaaaaaaaaaaaaaaaaaaaaaaaaaaaaaaaaaaaa","upstream":null,"upstream_gone":false,"ahead":null,"behind":null,"changes":{"staged":0,"unstaged":0,"untracked":0,"conflicts":0},"operation":null,"stash":0,"branches":{"local":1,"base":"origin/main","integrated":0,"not_integrated":0},"worktrees":{"linked":0,"dirty":0,"locked":0,"prunable":0,"list":[],"missing":0},"gitlink":{"recorded":"aaaaaaaaaaaaaaaaaaaaaaaaaaaaaaaaaaaaaaaa","checked_out":"aaaaaaaaaaaaaaaaaaaaaaaaaaaaaaaaaaaaaaaa","state":"ok","relation":null},"fetch_error":null,"attention":true,"error":null,"reasons":["detached"]},{"name":"empty","path":"/ws/empty","kind":"submodule","state":"uninitialized","branch":null,"detached":false,"head":null,"upstream":null,"upstream_gone":false,"ahead":null,"behind":null,"changes":{"staged":0,"unstaged":0,"untracked":0,"conflicts":0},"operation":null,"stash":0,"branches":{"local":0,"base":null,"integrated":null,"not_integrated":null},"worktrees":{"linked":0,"dirty":0,"locked":0,"prunable":0,"list":[],"missing":0},"gitlink":{"recorded":"aaaaaaaaaaaaaaaaaaaaaaaaaaaaaaaaaaaaaaaa","checked_out":null,"state":"uninitialized","relation":null},"fetch_error":null,"attention":false,"error":null,"reasons":[]},{"name":"broken","path":"/ws/broken","kind":"submodule","state":"error","branch":"main","detached":false,"head":"aaaaaaaaaaaaaaaaaaaaaaaaaaaaaaaaaaaaaaaa","upstream":"origin/main","upstream_gone":false,"ahead":0,"behind":0,"changes":{"staged":0,"unstaged":0,"untracked":0,"conflicts":0},"operation":null,"stash":0,"branches":{"local":1,"base":"origin/main","integrated":0,"not_integrated":0},"worktrees":{"linked":0,"dirty":0,"locked":0,"prunable":0,"list":[],"missing":0},"gitlink":{"recorded":"aaaaaaaaaaaaaaaaaaaaaaaaaaaaaaaaaaaaaaaa","checked_out":"aaaaaaaaaaaaaaaaaaaaaaaaaaaaaaaaaaaaaaaa","state":"ok","relation":null},"fetch_error":null,"attention":true,"error":{"code":"status-read-failed","message":"cannot read the repository status"},"reasons":["error"]}],"summary":{"total":5,"attention":3,"errors":1},"error":null}
